<!ELEMENT petit-texte (para)*>
<!ATTLIST petit-texte
	date CDATA #REQUIRED
>
<!ELEMENT para (titre, pgf+)?>
<!ELEMENT titre (#PCDATA)>
<!ELEMENT pgf (#PCDATA)>